{
  "queue_item_id": "queue-wave4-001",
  "goal_key": "uap-goal-driven-autonomy-wave4",
  "schedule_key": "local-tick-5m",
  "state": "ready",
  "idempotency_key": "wave4:queue-wave4-001",
  "priority_class": "standard",
  "retry_budget": {
    "max_attempts": 3,
    "backoff_profile": "exponential"
  },
  "retry_budget_remaining": 3,
  "attempt_count": 0,
  "dependency_keys": [
    "queue-wave4-000"
  ],
  "escalation_policy_ref": "planningops/contracts/escalation-gate-contract.md",
  "completion_policy_ref": "planningops/contracts/goal-completion-contract.md",
  "target_repo": "rather-not-work-on/monday",
  "work_payload_ref": "planningops/artifacts/backlog/goal-driven-autonomy-wave4-projected-issues.json",
  "lease_owner": "monday-local-worker-1",
  "lease_expires_at_utc": "2026-03-14T05:30:00Z"
}
